{
  "playbook_schema_version": "0.1",
  "tool": {
    "name": "finops-assess",
    "version": "0.1.0"
  },
  "generated_at": "1970-01-01T00:00:00+00:00",
  "source_report": {
    "path": "<redacted>/demo",
    "schema_version": "1.0",
    "pii_redaction": true
  },
  "row_count": 36,
  "output_artifacts": {
    "jsonl_sha256": "d343d60b0244e81e1c9ab8f153d0ebb43440a2a856a8101ca9b575032138bd22",
    "jsonl_byte_count": 76919
  },
  "pii_handling": {
    "mode": "salted_hash",
    "ticket_key_stability_by_surface": {
      "ado": "per_run",
      "azure": "per_run",
      "github": "per_run",
      "m365": "per_run"
    },
    "known_limitation": "ticket_key is per_run for ALL surfaces when PII redaction is on (the engine salts every principal — including Azure resource IDs — with a per-run secret).  Cross-run deduplication is unsafe under this mode.  Engine tenant-stable salting is deferred to #73; until then, run with --no-pii-redaction or accept that re-runs will produce duplicate tickets."
  },
  "surfaces": [
    "ado",
    "azure",
    "github",
    "m365"
  ],
  "sort_key": "(surface, rule_id, ticket_key, evidence_ref)",
  "templates_source": "importlib.resources:finops_assess.data.playbooks"
}
