{
  "playbook_schema_version": "0.1",
  "tool": {
    "name": "finops-assess",
    "version": "0.1.0"
  },
  "generated_at": "1970-01-01T00:00:00+00:00",
  "source_report": {
    "path": "<redacted>/samples",
    "schema_version": "1.0",
    "pii_redaction": true
  },
  "row_count": 40,
  "output_artifacts": {
    "jsonl_sha256": "eb5d9a1759e3be9d439e5ca260cdbccd1a2110aad9a2e7173009e19d18e0a110",
    "jsonl_byte_count": 88066
  },
  "pii_handling": {
    "mode": "salted_hash",
    "salt_mode": "tenant_stable",
    "ticket_key_stability_by_surface": {
      "ado": "stable",
      "azure": "stable",
      "github": "stable",
      "m365": "stable"
    },
    "known_limitation": null
  },
  "surfaces": [
    "ado",
    "azure",
    "github",
    "m365"
  ],
  "sort_key": "(surface, rule_id, ticket_key, evidence_ref)",
  "templates_source": "importlib.resources:finops_assess.data.playbooks"
}
